entity_name,entity_type,article_ids,application,symptom,treatment,cause,subtopic,definition,subdisease,detail,prevention,advice,complication
Thai lưu,disease,"['188', '190', '189']",,thai phụ có thể vẫn cảm thấy thai nhi vận động do thay đổi tư thế; khám thai định kỳ giúp phát hiện sớm thai lưu; nghe nhịp tim bằng doppler; siêu âm để xác định thai đã tử vong; thai nhỏ hơn dự kiến; biểu đồ phát triển giảm dần theo tuổi thai,sử dụng thuốc khởi phát chuyển dạ để tống thai lưu; phương pháp an toàn hơn phẫu thuật,nhau thai; dị tật bẩm sinh; sức khỏe mẹ; chấn thương dây rốn; chức năng nhau thai kém; chảy máu (xuất huyết) trước hoặc khi chuyển dạ; rau bong non – bánh nhau bong ra khỏi tử cung trước khi trẻ sinh ra; tiền sản giật – nguyên nhân tăng huyết áp ở sản phụ; bệnh ứ mật trong gan khi mang thai (icp) hay chứng cholestasis gây ngứa nhiều – đặc trưng của rối loạn chức năng gan trong thai kì; khiếm khuyết vật chất di truyền ở trẻ; đái tháo đường có sẵn từ trước; nhiễm trùng ở sản phụ có thể ảnh hưởng lên thai nhi; nhiễm khuẩn đường âm đạo; streptococcus nhóm B; escherichia coli (e.coli); klebsiella; enterococcus; haemophilus influenza; mycoplasma; ureaplasma; cúm; parvovirus b19; coxsackie virus; cytomegalovirus; herpes simplex; listeriosis; leptospirosis; lyme disease; sốt q; toxoplasmosis; bệnh sốt rét,,thai tử vong sau 24 tuần của thai kỳ; trước 24 tuần là sẩy thai.,,chẩn đoán thai lưu là cú sốc đối với thai phụ và gia đình; một tỷ lệ lớn thai lưu xảy ra ở những thai nhi khỏe mạnh và nguyên nhân thường không giải thích được,ngừng hút thuốc; tránh rượu bia; tránh chất gây nghiện; khám thai đầy đủ để theo dõi sức khỏe thai nhi; khuyến cáo nên chủng ngừa cúm theo mùa cho tất cả sản phụ trong bất kì giai đoạn nào của thai kì,hỗ trợ tinh thần: thai lưu gây cú sốc cho gia đình; cần siêu âm kiểm tra lại; cần hỗ trợ và tư vấn về các giải pháp xử trí; thai phụ chờ chuyển dạ tự nhiên và làm xét nghiệm máu thường quy sau mỗi 48 giờ; tư vấn nguy cơ trong lần mang thai tiếp theo; nữ hộ sinh sẽ kiểm tra sự phát triển và sức khỏe của thai nhi mỗi lần khám tiền sản và vẽ biểu đồ cho sự phát triển của thai nhi để chắc chắn rằng đứa trẻ đang phát triển; việc sản phụ để ý đến thai máy là rất quan trọng để phát hiện sớm những bất thường,nhiễm trùng; thai nhi thoái hóa trong tử cung; khó xác định nguyên nhân tử vong; tăng nguy cơ rối loạn đông máu
Nghỉ ngơi tại giường,topic,[],,,,,Chuyển dạ sinh non,,,,,bác sĩ yêu cầu sản phụ nên nghỉ ngơi một vài lần trong ngày hoặc nằm hoàn toàn tại giường,
Tăng cân,topic,[],tăng cân quan trọng cho sức khỏe mẹ và bé,,,,,,,tăng cân phù hợp giúp thai nhi phát triển tốt; mức tăng cân phụ thuộc vào bmi trước khi mang thai,,hạn chế đường và chất béo rắn; tham khảo bác sĩ về các hoạt động cần hạn chế,khó bú; tăng nguy cơ bệnh; biến chứng sinh; tăng nguy cơ sinh mổ; giảm nguy cơ biến chứng cho mẹ; gây sinh con nhẹ cân; tăng nguy cơ chậm phát triển; gây sinh con to; tăng nguy cơ béo phì cho mẹ và bé
Những điều ông bố cần biết,topic,[],ngày dự sinh được tính từ kỳ kinh cuối trừ 3 tháng cộng 7 ngày; kiểm tra thể chất; kiểm tra huyết áp; kiểm tra cân nặng; kiểm tra chiều cao; xét nghiệm máu; xét nghiệm nước tiểu; kiểm tra vùng chậu; xét nghiệm HIV; xét nghiệm giang mai; xét nghiệm các bệnh lây qua đường tình dục khác; siêu âm tuần 18-20; xét nghiệm tim thai; đo cân nặng; đo chiều cao bào thai; xác định vị trí bào thai; xét nghiệm dị tật bẩm sinh; xét nghiệm đái tháo đường thai kỳ; xét nghiệm Streptococcus nhóm B,,,,,,,thai kỳ kéo dài khoảng 40 tuần; chia thành 3 tam cá nguyệt; 6 tuần đầu phụ nữ cảm thấy mệt và đau rát; sinh mổ bình phục lâu hơn,,quan hệ khi mang thai: được phép nếu bác sĩ không cấm; không nên hút gần phụ nữ mang thai vì ảnh hưởng đến thai và trẻ sơ sinh; tham gia lớp sinh sản; tham quan khoa sản; chuẩn bị phương tiện di chuyển an toàn cho trẻ; cần điều chỉnh lối sống gia đình,
Viêm tiểu phế quản ở trẻ,disease,['264'],,sốt; khó thở; thở nhanh; thở khò khè; chảy mũi; ho nhẹ; ho trở nặng; cánh mũi phập phồng; các cơ dưới lồng ngực co rút; thở rên; các cơ bụng co thắt; tiếng thở khò khè; khó bú; khó nuốt; vùng quanh môi xanh tái; các đầu ngón tay xanh tái; đường thở bị tắc nghẽn; không đưa đủ oxi vào máu; không thể uống nước dễ dàng; uống ít hơn bình thường; miệng khô; khóc không có nước mắt; tiểu ít hơn bình thường; khó thở mức độ nhẹ đến vừa; mất nước,một loại thuốc giúp giãn nở các phế quản; điều trị tại bệnh viện do khó thở hoặc mất nước; hỗ trợ thở oxi; cho thức ăn đặc biệt dưới dạng chất lỏng; truyền dịch qua tĩnh mạch (iv); cho sử dụng mặt nạ oxy; chỉ điều trị tạm thời bằng phương pháp này cho đến khi hết nhiễm trùng,virus hợp bào hô hấp (rsv); các virus khác,,,,rsv dễ dàng lây truyền từ chất dịch nhầy hoặc nước miếng của người bị nhiễm virut (những giọt phân tử hô hấp tạo ra trong quá trình ho hoặc thở khò khè); bệnh thường lây lan từ những người trong gia đình hoặc từ các trung tâm giữ trẻ,bảo đảm mọi người phải rửa tay trước khi đụng đến con bạn,hãy gọi ngay cho bác sĩ nếu con bạn có một trong các dấu hiệu khó thở kể trên; hãy gọi cho bác sĩ nếu con bạn có những dấu hiệu mất nước dưới đây; dùng loại nước muối sinh lý do bác sĩ giới thiệu để làm mềm chất dịch nhầy trong mũi; không được sử dụng nước nhỏ mũi có bất cứ loại thuốc gì mà không có toa bác sĩ; dùng dụng cụ hút mũi để hút sạch mũi bé; cách này có hiệu quả nhất đối với các bé dưới 6 tháng tuổi; cho bé uống acetaminophen (theo liều lượng dành cho độ tuổi của bé) để hạ sốt; hỏi ý kiến bác sĩ trước khi cho bé dùng bất kỳ loại thuốc trị cảm nào; bảo đảm bé uống thật nhiều nước và chất lỏng để tránh mất nước; có thể bé sẽ muốn các thức uống loãng thay vì sữa hoặc sữa bột; bé có thể ăn chậm hơn và không muốn ăn bởi vì đang bị khó thở,
Vàng da sơ sinh,disease,['209'],,da bị vàng; kết mạc mắt bị vàng,,tăng nồng độ bilirubin trong máu; tình trạng tăng nồng độ bilirubin máu; sự ly giải sinh lý của hồng cầu; gan của trẻ không đủ khả năng loại bỏ bilirubin ra khỏi dòng máu,,,,vàng da có thể xuất hiện trong vòng 2 đến 3 ngày sau sinh; vàng da được quan sát dễ dàng nhất dưới ánh sáng tự nhiên và có thể khó nhận biết hơn ở những bé có da tối màu; bilirubin là một chất được hình thành bởi sự ly giải sinh lý của hồng cầu. chúng được chuyển hóa và đào thải nhờ gan.,,,
Progesterone,topic,[],có tác dụng ngăn ngừa sinh non chỉ khi cổ tử cung ngắn và mang đơn thai; ngăn ngừa sinh non nếu sản phụ đã có 1 lần sinh non đơn thai tự phát (tự phát nghĩa là tự chuyển dạ mà không cần dùng thuốc hay các phương pháp khác hoặc là ối vỡ sớm gây chuyển dạ) và mang đơn thai,khó chịu ở chỗ tiêm,progesterone đặt âm đạo làm giảm nguy cơ sinh non trong trường hợp đơn thai có cổ tử cung ngắn; progesterone tiêm làm giảm nguy cơ sinh non trong trường hợp đơn thai có tiền sử sinh non; điều trị với progesterone có thể dự phòng sinh non cho một số sản phụ nhất định; progesterone đặt âm đạo có tác dụng ngăn ngừa sinh non chỉ khi cổ tử cung ngắn và mang đơn thai; bắt đầu từ tuần 16 đến tuần 24 và 1 tuần 1 lần cho đến tuần 27,,Progesterone đặt âm đạo; Progesterone tiêm,,,progesterone là một hormone được cơ thể tạo ra; progesterone đóng vai trò rất quan trọng trong suốt thai kỳ; ngoài ra còn giúp phổi hoạt động tốt hơn để cung cấp nhiều oxy hơn cho sự phát triển của thai; sản phụ có thể sử dụng một dụng cụ như một chiếc tăm bông để đẩy progresterone vào trong âm đạo; thời gian bắt đầu điều trị từ tuần thai thứ 24 và cứ tiếp tục cho đến tuần 37; progesterone đặt âm đạo không phải lúc nào cũng có hiệu quả trong ngăn ngừa sinh non; progesterone đặt âm đạo không có tác dụng phụ cho cả sản phụ và thai nhi; không phải lúc nào progesterone tiêm cũng hiệu quả trong ngừa sinh non; 17 alpha - hydroxyprogesterone caproate (còn được gọi là 17p),,cần trao đổi với bác sĩ để biết được progesterone có thể giúp giảm nguy cơ sinh non của bạn hay không; sản phụ cần trao đổi với bác sĩ để hiểu rõ hơn nếu điều trị progesterone có hiệu quả với sản phụ; trao đổi với bác sĩ để hiểu rõ hơn nếu cần điều trị progesterone; trao đổi với bác sĩ về sự an toàn và tác dụng phụ của progesterone tiêm,nếu cơn co tử cung xảy ra trong giai đoạn đầu của thai kỳ có thể dẫn đến sẩy thai (là tình trạng thai chết trong tử cung trước 20 tuần); progesterone đặt âm đạo không có tác dụng phụ cho cả sản phụ và thai nhi
Gây tê tủy sống – ngoài màng cứng kết hợp,topic,[],,,,,,gây tê tuỷ sống – ngoài màng cứng kết hợp là một hình thức khác của gây tê vùng. hình thức gây tê này có lợi ích của cả gây tê tuỷ sống và gây tê ngoài màng cứng.,,,,,
Herpes,subdisease,['115'],,vết loét xuất hiện sau đó và tự lành trong 3–7 ngày,,virus; xét nghiệm máu giúp xác định nhiễm mới hoặc tái phát,,,,virus có thể lây ngay cả khi không có vết loét nhìn thấy; tái phát thường ít nghiêm trọng hơn lần đầu,tránh quan hệ khi có loét hoặc triệu chứng báo hiệu. sử dụng bao cao su giúp giảm nguy cơ nhưng không hoàn toàn bảo vệ vì loét có thể ở ngoài vùng che phủ.,,nguy cơ truyền cho trẻ cao (30–60%)
Cảm nhận cử động thai nhi,topic,[],,,,,,,,một số người khác có thể cảm nhận được những vận động của con bạn khi nó “đạp”; những vận động đó sẽ giúp bé luyện tập chuẩn bị cho cuộc sống bên ngoài tử cung,,,
Indomethacin,subtopic,[],,buồn nôn; nôn; chóng mặt; xuất huyết âm đạo; ợ nóng,,,,,,,,,vàng da; viêm ruột hoại tử (nec); xuất huyết trong não; xuất huyết trong tim; còn ống động mạch (pda – bệnh tim bẩm sinh phổ biến ở trẻ sinh non tháng); tăng áp lực phổi; thiểu ối là tình trạng sản phụ có quá ít nước ối; nước ối là dịch bao quanh thai nhi trong tử cung; viêm dạ dày
Xét nghiệm giang mai,topic,[],phát hiện sớm,,có thể điều trị,,,,,,dự phòng giang mai bẩm sinh,,
Song thai bất tương xứng,subtopic,['78'],,,,hội chứng truyền máu song thai (tmst),,,,,,,biến chứng trong thai kỳ; biến chứng sau sinh
Lập kế hoạch,topic,[],có thể kiểm tra chỉ số BMI trước khi mang thai,,,lo âu; những chất này có thể ảnh hưởng đến khả năng sinh sản và sức khỏe của trẻ; buồn bã; căng thẳng kéo dài; hút thuốc trong thai kỳ; khói thuốc lá thụ động,,,,,tiêm phòng vaccine trước hoặc trong thai kỳ theo khuyến cáo; tiêm chủng rubella; tiêm chủng thủy đậu; tiêm chủng viêm gan B,chăm sóc sức khỏe tiền thai kỳ giúp bé có thể chào đời khỏe mạnh; bắt đầu bằng việc lên kế hoạch và hành động; thực hiện các bước để đạt mục tiêu có thai và sinh em bé khỏe mạnh; đi khám bác sĩ sản khoa để được tư vấn chăm sóc sức khỏe tiền thai kỳ; hãy liệt kê câu hỏi và vấn đề cần trao đổi để không bỏ sót khi gặp bác sĩ; cần điều chỉnh trước khi mang thai; tiêm chủng đúng thời điểm giúp mẹ có thai kỳ khỏe mạnh và bảo vệ em bé suốt đời; duy trì cân nặng hợp lý trước khi mang thai; tạo lối sống ăn uống lành mạnh và tập thể dục thường xuyên; chia sẻ thông tin tiền sử gia đình với bác sĩ để phòng ngừa rủi ro cho con; chú ý đến sức khỏe tinh thần; tìm sự hỗ trợ từ bác sĩ hoặc chuyên gia tâm lý; duy trì thói quen lành mạnh; khám thai định kỳ để được hỗ trợ chăm sóc trong suốt thai kỳ; phụ nữ có khả năng mang thai nên bổ sung 400 microgram axit folic mỗi ngày trước khi mang thai và trong 12 tuần đầu thai kỳ để giảm nguy cơ dị tật ống thần kinh; hãy yêu cầu bác sĩ kê đơn bổ sung liều cao khi cần; không nên uống rượu khi mang thai; không có mức độ an toàn nào cho rượu trong thai kỳ; nên tham khảo ý kiến nữ hộ sinh hoặc bác sĩ; một số loại thuốc cần đổi sang thuốc an toàn hơn trước khi mang thai; không tự ý ngưng thuốc mà không hỏi ý kiến bác sĩ; kiểm tra và cập nhật tiêm chủng trước khi mang thai; nên xét nghiệm sàng lọc trước khi mang thai; nên tham khảo tư vấn di truyền trước khi mang thai,một số thuốc có thể gây dị tật bẩm sinh; ảnh hưởng đến cuộc sống; nhẹ cân; sinh non; các biến chứng khác; tăng nguy cơ sẩy thai; có hại cho thai nhi; khó khăn khi mang thai; giảm hiệu quả điều trị khả năng sinh sản; tăng nguy cơ tăng huyết áp; tăng nguy cơ huyết khối; tăng nguy cơ đái tháo đường thai kỳ
Soi cổ tử cung,topic,['43'],,sốt; chảy máu; ớn lạnh; mụn cóc sinh dục; viêm cổ tử cung; polyp lành tính; cơn đau; ra ít máu âm đạo; đau 1–2 ngày; ra máu hoặc dịch âm đạo có màu đen vài ngày; chảy máu âm đạo nhiều (hơn 1 băng/giờ); đau bụng dưới nặng,,,,,,có thể được làm nhiều lần hoặc để kiểm tra kết quả điều trị; dung dịch dịu nhẹ được bôi vào cổ tử cung giúp quan sát rõ hơn,,không quan hệ tình dục; hạn chế hoạt động; không dùng tampon; không thụt rửa cho đến khi lành thương,
xuất hiện mạch máu hình mạng nhện ở cổ,symptom,[],,Ba tháng đầu,,,,,,,,,
Phương pháp theo dõi dịch nhầy cổ tử cung,subtopic,[],,giai đoạn khô; dịch nhầy dính; dịch nhầy ướt; dịch nhầy trơn,,,,,,ngày cuối dịch ướt (ngày đỉnh) thường trùng với rụng trứng,,,
Song thai cùng trứng,subtopic,['78'],,,,,,một trứng đã thụ tinh phân đôi thành hai phôi,,,,,
Triệt sản ống dẫn trứng,subtopic,[],,,,,,triệt sản ống dẫn trứng là các thủ thuật dành cho phụ nữ nhằm đóng kín ống dẫn trứng. ngăn cản trứng di chuyển xuống tử cung và ngăn tinh trùng gặp trứng.,,,,,
Tăng huyết áp,disease,"['55', '54']",theo dõi huyết áp thường xuyên; có thể tự đo tại nhà; siêu âm theo dõi thai,,nếu nhẹ có thể không cần thuốc hoặc giảm liều; nếu nặng cần dùng thuốc hạ áp trong thai kỳ,,,tăng huyết áp mạn tính là tình trạng tăng huyết áp được chẩn đoán trước khi mang thai hay trước tuần lễ thứ 20 của thai kỳ hoặc kéo dài đến hơn 12 tuần sau sinh,,huyết áp cao xuất hiện sau 20 tuần; tăng huyết áp đang là một vấn đề đáng quan tâm khi mang thai; tăng huyết áp xuất hiện khi mang thai có thể là một dấu hiệu của tiền sản giật; mặc dù tăng huyết áp thai kỳ và tiền sản giật có thể liên quan với nhau nhưng chúng vẫn có sự khác biệt; bạn có thể bị tăng huyết áp mãn tính nhưng vẫn có thể sinh ra những em bé khỏe mạnh,,nên đến gặp bác sĩ trước khi mang thai để kiểm tra huyết áp của bạn có đang được kiểm soát tốt; xem xét các loại thuốc hạ áp đang sử dụng vì một số loại thuốc hạ áp không an toàn trong thai kỳ và có thể ảnh hưởng không tốt cho thai nhi; tập thể dục đều đặn; cần theo dõi sát tại trung tâm chẩn đoán trước sinh và đơn vị sơ sinh; có sự chăm sóc đặc biệt cho trẻ sau sinh; chăm sóc sức khỏe mẹ chính là chăm sóc sức khỏe thai nhi tốt nhất; dùng thuốc hạ áp theo chỉ định; khám thai đầy đủ; nghỉ ngơi theo chỉ định nếu có tiền sản giật; theo dõi cân nặng và tránh tăng cân quá nhiều,sinh non; nhau bong non; thai chậm phát triển; đột quỵ; tiền sản giật; thường biến mất sau sinh nhưng làm tăng nguy cơ cao huyết áp sau này; tăng áp lực cho tim; tăng áp lực cho thận; tăng nguy cơ tim mạch; tăng nguy cơ thận; tăng nguy cơ đột quỵ; nguy cơ mổ lấy thai cao hơn; suy tim tiến triển; mờ mắt; co giật; biến chứng gan; biến chứng thận; giảm biến chứng; tăng huyết áp mãn tính có khả năng gây ra những ảnh hưởng không tốt đối với sự phát triển của thai nhi
Thuốc tránh thai,subtopic,['13'],Điều trị bệnh lao; Điều trị nhiễm trùng da như nấm da bàn chân và nấm bẹn; Điều trị các triệu chứng của rối loạn giấc ngủ như chứng ngủ rũ và ngưng thở khi ngủ; Điều trị trầm cảm nhẹ đến trung bình và rối loạn giấc ngủ; Sử dụng cho các vấn đề tiêu hóa như táo bón nặng và hội chứng ruột kích thích; Ngăn không cho trứng phóng thích khỏi buồng trứng; Làm buồng trứng ngưng phóng thích trứng,buồn nôn; ra máu bất thường; rậm lông; mụn trứng cá; đau đầu; lo âu; tăng cân; căng ngực; rối loạn kinh; mất chu kỳ; trầm cảm; tăng cân; ít gây đau dạ dày; ít gây đau đầu; ra máu giữa kỳ; cảm giác đói; đau tức ngực; mệt mỏi; đau dạ dày; nôn; kinh nguyệt đến sớm; kinh nguyệt đến muộn,thuốc tránh thai kết hợp (estrogen + progestin); viên chỉ chứa progestin; liều 2 uống cách 12h,một số loại thuốc có thể làm giảm hiệu quả của hormone trong biện pháp tránh thai.; penicillin; amoxicillin; rifampin (rifadin); một số loại thuốc điều trị HIV có thể ảnh hưởng đến thuốc ngừa thai; darunavir (prezista); efavirenz (sustiva); lopinavir/ritonavir (kaletra); nevirapine (viramune); felbamate (felbatol); oxcarbazepine (trileptal); phenobarbital (luminal); primidone (mysoline); topiramate (topamax); modafinil (provigil) làm giảm hiệu quả của thuốc ngừa thai; griseofulvin được sử dụng để điều trị nhiễm trùng da như nấm da bàn chân và nấm bẹn; ketoconazole chủ yếu được sử dụng khi các loại thuốc chống nấm khác không có sẵn hoặc không có tác dụng; một số loại thuốc chống co giật làm tăng sự phân hủy hormone trong thuốc tránh thai; chứa hormon ngăn rụng trứng; thuốc điều trị HIV; rifampin; griseofulvin; một số thuốc chống co giật; griseofulvin (kháng sinh),Viên uống tránh thai kết hợp; Thuốc tiêm tránh thai,,,thuốc tránh thai hằng ngày: ảnh: thuốc tránh thai hằng ngày.; griseofulvin được sử dụng để điều trị nhiễm trùng da như nấm da bàn chân và nấm bẹn; ketoconazole chủ yếu được sử dụng khi các loại thuốc chống nấm khác không có sẵn hoặc không có tác dụng; thuốc ngừa thai sẽ không ảnh hưởng đến hiệu quả hoạt động của thuốc chống động co giật; có hai loại chính; thường giảm sau vài tháng; khiến tinh trùng khó xâm nhập và trứng khó bám; cần dùng ít nhất 1 tháng mới có tác dụng tránh thai đầy đủ; thành phần chính: levonorgestrel (chỉ chứa progestin); còn gọi là viên tránh thai sáng hôm sau; uống trong 72h có thể giảm nguy cơ có thai 75–89%; thấp hơn các biện pháp tránh thai thường xuyên; đau dạ dày (hết sau 2 ngày); nôn (cần uống lại nếu nôn trong 1h); ít gây mệt mỏi hơn viên phối hợp; kinh ngắn lại hoặc ngừng hẳn,,bạn cần phải tránh một số loại thuốc nếu muốn biện pháp tránh thai có chứa hormone hoạt động hiệu quả.; bạn không phải lo lắng khi dùng chung những loại thuốc kháng sinh thông thường với thuốc tránh thai.; nói chuyện với bác sĩ về loại thuốc tốt nhất bạn có thể dùng được; sử dụng một biện pháp tránh thai khác khi bạn đang sử dụng modafinil (provigil) và trong một tháng sau khi bạn ngừng sử dụng; một số loại thảo dược không nên kết hợp với thuốc tránh thai; những phụ nữ uống thuốc tránh thai và st. john’s wort đồng thời có tỷ lệ chảy máu đột ngột cao hơn và gia tăng sự phân hủy estrogen trong cơ thể của họ; các biện pháp thảo dược khác có thể ảnh hưởng đến hiệu quả hoạt động của thuốc tránh thai; tránh sử dụng st. john’s wort (cây ban âu) vì có thể làm tăng tỷ lệ chảy máu đột ngột và phân hủy estrogen; tránh sử dụng saw palmetto vì có thể ảnh hưởng đến hiệu quả hoạt động của thuốc tránh thai; tránh sử dụng cỏ linh lăng vì có thể ảnh hưởng đến hiệu quả hoạt động của thuốc tránh thai; tránh sử dụng thuốc tỏi vì có thể ảnh hưởng đến hiệu quả hoạt động của thuốc tránh thai; tránh sử dụng hạt lanh vì có thể ảnh hưởng đến hiệu quả hoạt động của thuốc tránh thai; nên uống mỗi ngày vào cùng thời điểm; thường ít gây tác dụng phụ hơn so với thuốc tránh thai phối hợp; phù hợp cho phụ nữ đang cho con bú vì không ảnh hưởng đến sữa; an toàn hơn ở phụ nữ trên 35 tuổi; an toàn hơn ở người hút thuốc; an toàn hơn ở người béo phì; an toàn hơn ở người tăng huyết áp; an toàn hơn ở người có tiền sử đông máu; khoảng 2–3/100 phụ nữ vẫn có thai mỗi năm dù dùng đúng cách. hiệu quả phụ thuộc vào việc uống đúng giờ hàng ngày. nếu uống trễ hơn 3 giờ cần uống bổ sung ngay và dùng thêm biện pháp dự phòng (bao cao su) trong 48 giờ.; không ngừa được các bệnh lây truyền qua đường tình dục (stis); uống mỗi ngày vào cùng giờ; hiệu quả cao nhất nếu dùng càng sớm càng tốt; nên trao đổi với bác sĩ về lựa chọn phù hợp; uống ngày đầu chu kỳ kinh; uống chủ nhật đầu tiên sau khi bắt đầu chu kỳ (cần biện pháp phụ trợ 7 ngày); điều hòa kinh; giảm lượng máu; giảm mụn; tăng mật độ xương tiền mãn kinh; uống hàng ngày trong 1 năm,làm chất nhầy cổ tử cung dày lên; niêm mạc tử cung mỏng đi; kinh nguyệt không đều; tăng nguy cơ mang thai; tinh trùng khó xâm nhập; trứng khó bám
