entity_name,entity_type,article_ids,application,symptom,treatment,cause,subtopic,definition,subdisease,detail,prevention,advice,complication
Ngôi mông,topic,['72'],,,phần lớn trẻ ngôi mông được sinh ra bằng cách mổ lấy thai theo kế hoạch; mổ lấy thai (c-section); mổ lấy thai; xoay em bé trong tử cung người mẹ bằng một thủ thuật gọi là ngoại xoay thai,trẻ sinh non; người phụ nữ đã từng mang thai nhiều lần; có nhiều hơn 1 bào thai trong tử cung (sinh đôi hoặc hơn); tử cung có quá nhiều dịch ối; tử cung có quá ít dịch ối; tử cung có hình dạng không bình thường; tử cung có u xơ; nhau thai che phủ một phần hoặc toàn bộ lối ra của tử cung; em bé xoay phần mông (hoặc chân) xuống dưới; em bé nằm ngược trong giai đoạn sớm của thai kỳ; em bé sinh non; bất thường về lượng nước ối xung quanh em bé có thể là nguyên nhân gây sinh ngôi mông,,,,trẻ ngôi đầu thường được sinh thường ngả âm đạo an toàn hơn và dễ dàng hơn những trẻ ngôi mông,,phải khám thai định kỳ; bác sĩ sẽ cho bạn biết khi em bé của bạn là ngôi mông và giúp hoạch định những việc cần làm; hướng dẫn cho thai phụ những bài tập ở nhà để có thể giúp em bé xoay đầu xuống dưới,nhiễm trùng; chảy máu; vấn đề với thuốc giảm đau; nguy cơ cao hơn cho thai nhi; nguy cơ sa dây rốn; chèn ép dây rốn; cắt đứt máu nuôi thai nhi; gặp nhiều biến chứng hơn; em bé ngôi mông có thể rất nhỏ; em bé ngôi mông có thể bị khuyết tật; em bé ngôi mông được sinh ngả âm đạo có nhiều khả năng bị tổn thương trong hoặc sau khi sinh; em bé sinh ngược được sinh ngả âm đạo có nhiều khả năng mắc dị tật bẩm sinh ở hông; em bé sinh ngược được sinh ngả âm đạo có nhiều khả năng mắc dị tật bẩm sinh ở xương đùi; các biến chứng ở dây rốn dễ xảy ra ở trẻ ngôi mông sinh ngả âm đạo; dây rốn bị chèn ép khi sinh; tổn thương thần kinh và não do thiếu oxy; thời gian nằm viện dài hơn cho cả mẹ và bé
Đau bụng kinh nguyên phát,subdisease,['1'],,đau co thắt ở vùng bụng dưới; cơn đau có thể lan ra phía sau; cơn đau có thể lan ra mặt giữa của đùi,dùng thuốc chống co thắt đơn giản; axit mefenamic 250 - 500 mg mỗi 8 tiếng; ibuprofen 400 mg mỗi 8 tiếng,,,,,không có bệnh vùng chậu nào khác đi kèm; cơn đau sẽ tự giảm khi người phụ nữ mang thai hoặc sau khi sinh con; thường xuất hiện trong vòng hai năm sau khi có kinh nguyệt,,cải thiện sức khỏe thể chất và ổn định tâm lý; trấn an người bệnh; có thể loại trừ các bệnh vùng chậu bằng siêu âm,
Viêm túi mật mãn tính,subdisease,['260'],,,,,,,,có thể tồn tại kéo dài trong một thời gian. có thể được đặc trưng bởi sự dày lên và co lại của thành túi mật và dẫn đến mất khả năng lưu trữ mật.,,,
Vàng da ở trẻ sinh non,disease,['236'],,mắt có màu vàng; da có màu vàng,,gan chưa phát triển đầy đủ; hoạt động gan chưa tốt,,,,,,,
Sàng lọc trước sinh,topic,['10'],các xét nghiệm sàng lọc thường là một phần của quá trình quản lý thai nghén và được thực hiện vào các thời điểm khác nhau trong quý một và quý hai của thai kỳ; sàng lọc trước sinh bao gồm các xét nghiệm đo nồng độ của một số chất trong máu mẹ kết hợp với kiểm tra siêu âm; các xét nghiệm này đánh giá nguy cơ thai nhi mắc hội chứng Down và các thể tam nhiễm khác cũng như dị tật ống thần kinh; Đánh giá nguy cơ thai nhi mắc hội chứng down và các thể tam nhiễm khác cũng như dị tật ống thần kinh,,,,,,,,,,
Ba tháng đầu,topic,['35'],dùng que thử thai tại nhà; bác sĩ có thể xác nhận việc bạn đang có thai hay không,trễ kinh; chảy máu một chút; cảm thấy mệt mỏi; một số thức ăn hoặc mùi hương có thể làm tăng buồn nôn; buồn nôn; tính khí thất thường; nôn; hay quên; khó tập trung; choáng váng; chóng mặt; táo bón; ngực căng; ngực phồng; ngực nặng hơn; xuất hiện hạt nhỏ quanh núm vú; có khí hư trắng; ra ít huyết âm đạo; ợ nóng; đau bụng nhẹ,,hormone thai kỳ gây ra; căng thẳng; mệt mỏi; hormone; cảm xúc đi cùng việc mang thai; cơ thể sản xuất thêm máu cho thai nhi; đói; nội tiết tố làm tiêu hóa chậm lại; thức ăn lưu lại lâu hơn trong dạ dày; tiêu hóa chậm; viên đa sinh tố chứa sắt,,,,bạn sẽ cảm thấy khỏe hơn khi bước qua 3 tháng giữa; triệu chứng thường xuất hiện vài ngày sau khi trễ kinh; triệu chứng thường biến mất vào 3 tháng cuối thai kỳ; vòng eo bắt đầu mở rộng do thai và tử cung phát triển; tùy vóc dáng mà sự thay đổi có thể rõ ở tam cá nguyệt thứ hai; ngực tiếp tục thay đổi để chuẩn bị cho việc cho con bú,,bác sĩ có thể tư vấn về việc chăm sóc khi mang thai; nên ngủ lâu hơn vào ban đêm và tranh thủ thêm giấc ngủ ngắn trong ngày; ăn nhiều chất xơ; dùng thuốc làm mềm phân theo hướng dẫn bác sĩ,chóng mặt kèm chảy máu âm đạo hoặc đau bụng
Quá trình thụ thai,topic,[],,,,khi tinh trùng gặp trứng thì ít nhất một tinh trùng phải xuyên qua và đi vào bên trong lớp vỏ ngoài của trứng; noãn di chuyển về phía tử cung; phôi nang bám vào thành tử cung và làm tổ,,,,quá trình này được gọi là thụ tinh,,,
Làm mềm cổ tử cung,topic,['73'],,,prostaglandin được dùng để làm mềm và kích thích co tử cung; có thể dùng thiết bị đặc biệt để giãn cổ tử cung,,,,,,,,
Mất cân bằng hormone,topic,[],progesterone điều hòa kinh nguyệt và chuẩn bị niêm mạc tử cung cho trứng đã thụ tinh làm tổ,mệt mỏi; táo bón; nhức đầu; căng tức vú; khó ngủ; đau nửa đầu; phiền muộn; tâm trạng thất thường,,căng thẳng kéo dài; mất cân bằng nội tiết tố là nguyên nhân hàng đầu gây vô sinh; nồng độ progesterone thấp có thể cản trở việc thụ thai; tập thể dục quá sức; thừa cân; mãn kinh ở phụ nữ lớn tuổi,,,,progesterone là hormone quan trọng trong khả năng mang thai,,giảm căng thẳng; duy trì cân nặng hợp lý; ăn uống điều độ,
Tập thể dục,topic,[],,,,,,,,dây chằng và khớp lỏng lẻo; tim đập nhanh hơn,,nên duy trì hoạt động thể chất phù hợp; nên tham khảo ý kiến bác sĩ; giảm khó chịu trong thai kỳ; giảm đau lưng; tăng cường cơ bụng; cải thiện lưu thông máu; nâng cao năng lượng; cải thiện tim mạch; hỗ trợ giấc ngủ; giảm căng thẳng; tăng sự tự tin; chuẩn bị sinh nở dễ dàng hơn; giảm nguy cơ đái tháo đường thai kỳ; hỗ trợ lấy lại cân nặng sau sinh; tránh bắt đầu với bài tập khó; tạm dừng thể thao cường độ cao cho đến sau sinh; các bài tập cần tránh: aerobic cường độ cao; các bài tập cần tránh: gập bụng/ngồi dậy; các bài tập cần tránh: gập lưng; các bài tập cần tránh: hot yoga; các bài tập cần tránh: lặn; các bài tập cần tránh: nâng tạ; các bài tập cần tránh: nằm ngửa (tam cá nguyệt 2–3); các bài tập cần tránh: nằm sấp; các bài tập cần tránh: squat sumo sâu và nâng tạ sumo; các bài tập cần tránh: thái cực quyền; các bài tập cần tránh: thể thao va chạm; các bài tập cần tránh: tập luyện ngắt quãng cường độ cao; các bài tập cần tránh: đẩy tạ qua đầu; các bài tập cần tránh: động tác kéo dãn khớp quá mức,hạ huyết áp gây chóng mặt; bụng to làm thay đổi trọng tâm dễ ngã
X quang,topic,['50'],nếu chụp X quang cần thiết cho chẩn đoán thì vẫn nên thực hiện.; siêu âm là lựa chọn an toàn và hiệu quả; mri cũng an toàn trong quý đầu thai kỳ,,,,,x quang là một loại tia xạ không nhìn thấy được,,nhưng nguy cơ này rất thấp,,,không gây dị tật bẩm sinh; không làm tăng tỷ lệ dị tật
Siêu âm sàng lọc,subtopic,['41'],,,,,,,,,,nên siêu âm sàng lọc ≥1 lần (tuần 18–22).,
Thuỷ đậu,disease,"['256', '61']",,khó thở; đau ngực; đau đầu; nôn ói; mệt nhiều; ra huyết âm đạo; bóng nước chảy máu; nổi quá nhiều bóng nước; mệt mỏi nhiều,,virus; virus herpes zoster; nhiễm virus từ người đang mắc bệnh,,thuỷ đậu (trái rạ) là bệnh do virus herpes zoster,,thời gian ủ bệnh: 10 ngày – 3 tuần; người bệnh có thể truyền virus từ 2 ngày trước khi nổi bóng nước cho đến khi bóng nước đóng vảy,tiêm ngừa thuỷ đậu có vai trò quan trọng trong phòng bệnh khi mang thai,phụ nữ mắc thuỷ đậu nên tránh tiếp xúc với thai phụ khác hoặc những người đang mong muốn có thai,viêm phổi; viêm gan
Nifedipine,subtopic,[],,buồn nôn; táo bón; chóng mặt; hạ huyết áp; đau đầu; đỏ da; tiêu chảy; ngất,,,,,,,,,
Siêu âm ngã âm đạo,topic,['39'],,đau bụng; chảy máu,,,,,,nhiều phụ nữ sẽ được chỉ định siêu âm ngã âm đạo vào quý i thai kỳ; sản phụ nằm tư thế sản khoa; không đau nhưng hơi khó chịu; quá trình 30–60 phút,,nếu có bất thường → cần làm thêm xét nghiệm; thường một lần trong quý i. có thể lặp lại nếu bác sĩ nghi ngờ vấn đề sức khỏe thai nhi,nguy cơ sinh non
HIV,subdisease,"['38', '249', '44', '67', '105']",nếu kết quả hiv âm tính: không nhiễm bệnh; thời điểm xét nghiệm hiv: nên làm ngay trong lần khám thai đầu tiên; xét nghiệm hiv,triệu chứng giống cúm trong giai đoạn đầu,điều trị HIV khi mang thai có 2 mục đích: bảo vệ sức khỏe mẹ và giảm nguy cơ lây sang con. điều trị thường dùng nhiều thuốc phối hợp (phác đồ).; thuốc chống viêm được chỉ định trong sinh mổ; điều trị bằng thuốc arv và biện pháp y tế; có thể giảm xuống ~1% nếu điều trị; dùng thuốc đặc trị HIV; sinh mổ; con sẽ dùng thuốc đặc trị trong 6 tuần,virus suy giảm miễn dịch ở người (hiv); quan hệ tình dục; dùng chung kim tiêm; mẹ truyền sang con khi mang thai hoặc cho con bú; nhiều phụ nữ nhiễm hiv nhưng không biết,,HIV (vi rút suy giảm miễn dịch ở người) là loại vi rút gây hội chứng suy giảm miễn dịch mắc phải (aids).; tải lượng vi rút là lượng vi rút có trong cơ thể; hiện chưa có vắc-xin hay thuốc chữa khỏi hiv/aids.,,người bệnh có thể không biết mình nhiễm cho đến khi phát bệnh nếu không xét nghiệm; cần theo dõi tải lượng vi rút và số lượng cd4; tải lượng cao và cd4 thấp → nguy cơ lây truyền mẹ–con và nguy cơ bệnh cao; virus tấn công và phá hủy tế bào cd4 của hệ miễn dịch khiến cơ thể suy giảm khả năng chống bệnh; HIV không lây qua tiếp xúc thông thường hay da lành; giúp giảm nguy cơ lây truyền từ 25% xuống còn ~1%; điều trị giảm nguy cơ lây truyền từ 25% xuống ~1%; tuy nhiên cần lưu ý giai đoạn cửa sổ (4–8 tuần sau phơi nhiễm mới cho kết quả dương tính),hiện không có vaccine chống hiv.; dùng thuốc chống HIV trong thai kỳ; sinh mổ nếu tải lượng HIV cao; dùng thuốc khi chuyển dạ và sau sinh; cho bé uống thuốc sau sinh; không cho bé bú; dùng bao cao su ngay cả khi mang thai để tránh nhiễm thêm bệnh lây truyền qua đường tình dục; sử dụng bao cao su đúng cách trong quan hệ tình dục; không dùng chung kim tiêm; xét nghiệm HIV cho bạn tình; cai nghiện ma túy; bao cao su phải được sử dụng mỗi lần quan hệ để giảm nguy cơ lây hiv.; bao cao su từ da tự nhiên hoặc da cừu không bảo vệ được.; bao cao su latex/polyurethane hiệu quả nhất.,xét nghiệm là một phần quan trọng trong chăm sóc tiền sản; những người được trung tâm y tế cho rằng có nguy cơ mắc bệnh cao cũng nên được tư vấn; dùng thuốc đặc trị HIV và sinh mổ có thể được khuyến nghị; phụ nữ nhiễm hiv không nên cho con bú; có thể được xét nghiệm nhanh khi chuyển dạ nếu chưa xét nghiệm trước đó,thời gian từ khi nhiễm HIV đến khi biểu hiện aids có thể kéo dài nhiều tháng đến nhiều năm; 99% mẹ HIV không truyền bệnh cho con; nguy cơ lây truyền mẹ–con; nguy cơ bệnh cao; hệ miễn dịch yếu; dễ viêm nhiễm sau phẫu thuật; vết mổ lâu lành; lây sang con; tiến triển thành aids khi cd4 giảm thấp hoặc có nhiễm trùng cơ hội; lây cho con; lây truyền từ mẹ sang con; lây truyền khi mang thai; lây truyền khi sinh nở; lây truyền khi cho bú; em bé có thể nhiễm hiv qua sữa mẹ
đau nhức lưng,symptom,[],,Ba tháng cuối,,,,,,,,,
Thể dục,topic,[],,máu hoặc dịch chảy từ âm đạo; đau bụng hoặc đau âm đạo đột ngột; co thắt liên tục sau khi nghỉ 30 phút,,,,,,,,hãy hỏi bác sĩ để đảm bảo việc bạn tập thể dục trong thời gian mang thai là an toàn; kiểm tra với bác sĩ trước khi bắt đầu bất kỳ chương trình thể dục nào; tăng dần cường độ nếu cảm thấy khỏe; các bài tập tốt nhất cho thai phụ là những bài không tạo thêm trọng lượng cho cơ thể; trao đổi với bác sĩ để chọn bài tập tốt nhất; tránh các hoạt động làm tăng nguy cơ té ngã hoặc chấn thương như thể thao tiếp xúc hoặc thể thao gắng sức; ngay cả va chạm nhẹ vào bụng cũng nguy hiểm trong thai kỳ; tránh đứng quá lâu; duy trì chế độ ăn uống cân bằng; lắng nghe cơ thể và báo với bác sĩ nếu gặp các triệu chứng bất thường; báo với bác sĩ nếu có đau ngực; báo với bác sĩ nếu có khó thở; báo với bác sĩ nếu có nhức đầu kéo dài; báo với bác sĩ nếu có chóng mặt; báo với bác sĩ nếu có buồn nôn; báo với bác sĩ nếu có hoa mắt; báo với bác sĩ nếu có nhìn mờ sau khi tập luyện,
Surfactant,topic,[],giúp các túi khí được giữ ở trạng thái phồng trong phổi,,,sự thiếu surfactant,Sinh cực non,surfactant là một chất giúp các túi khí được giữ ở trạng thái phồng trong phổi,,phổi bắt đầu tạo surfactant vào khoảng tuần thứ 23 của thai kỳ,,liệu pháp surfactant chỉ được sử dụng ở những bệnh viện nơi mà đội ngũ nhân viên được đào tạo đặc biệt về liệu pháp này và cách chăm sóc những trẻ ốm nặng,hội chứng suy hô hấp (rds) ở trẻ sinh non
Sau sẩy thai,subtopic,[],,đau bụng; chảy máu; chóng mặt; chảy máu âm đạo; rỉ sữa ở vú; suy yếu sức khỏe; lượng đường trong cơ thể tăng nhanh; chảy máu ít hoặc rỉ máu; đau bụng dưới tương tự đau bụng kinh,phẫu thuật nong và nạo được thực hiện để loại bỏ các mô còn sót lại của thai nhi ra khỏi tử cung,sẩy thai,,,,cơ thể các chị em sẽ mất khoảng vài tuần đến vài tháng để giảm bớt được các triệu chứng và phục hồi lại sức khỏe; chảy máu do sẩy thai bắt đầu xuất hiện một đốm nhẹ và sau đó chảy máu ngày càng nhiều hơn kèm theo cục máu đông; đau bụng sau khi sẩy thai thường do các cơn co thắt của tử cung; chuỗi các hiện tượng xảy ra bên trong tử cung sẽ gây ra những cơn đau bụng dữ dội; những cơn đau này lan sang các bộ phận khác của cơ thể và phần lưng dưới bị ảnh hưởng nhiều nhất; hormone hcg vẫn còn trong máu vài tháng sau khi sẩy thai và nồng độ này chỉ về 0 sau khi các mô nhau thai bị tống xuất hoàn toàn; các cơ sở y tế sẽ đo nồng độ hcg bằng cách lấy mẫu máu của bạn; phải mất ít nhất hai tuần sau sẩy thai để cổ tử cung đóng lại và tử cung co trở lại kích thước bình thường; máu chỉ ngừng chảy khi tử cung trở lại kích thước bình thường; mất khoảng vài ngày đến vài tháng để cơ thể lành lại sau khi sẩy thai; chảy máu âm đạo có thể kéo dài đến một tuần; đau bụng dưới lên đến hai ngày; thời gian chữa bệnh cũng phụ thuộc vào mức độ tổn thương tinh thần mà bạn đang gánh chịu; chính bản thân bạn phải đối mặt và vượt qua nó; thức ăn ngon miệng; tùy vào những trường hợp khác nhau mà việc phục hồi là khác nhau; đậu nành rất tốt cho sức khỏe; đau bụng dưới tương tự đau bụng kinh có thể kéo dài đến 2 ngày sau sẩy thai; những triệu chứng này thường hết trong vòng 1 tuần; một vài hormone liên quan đến thai nghén có thể tồn tại trong máu 1 đến 2 tháng,nắm rõ những thực phẩm nên ăn và nên tránh sau khi sẩy thai; không chỉ phục hồi sau sẩy thai mà còn ngăn ngừa sự việc đau lòng này xảy ra trong tương lai,bác sĩ có thể giúp: bác sĩ sẽ giúp bạn hiểu được nguyên nhân sâu xa của vấn đề; tránh căng thẳng: ngừng tập trung quá vào nỗi đau thể xác và tinh thần; xác định lý do tổn thương: xác định lý do: bạn đã từng sẩy thai trước đó chưa?; đừng tự trách mình: sẩy thai thường là một bất thường về nhiễm sắc thể và không chỉ do sơ xuất của người mẹ; xoa bóp vùng tử cung giúp tử cung trở lại kích thước bình thường trước khi mang thai; nghỉ ngơi nhiều nhất có thể; uống sữa nóng để dễ ngủ hơn; tập các bài tập nhẹ bất cứ khi nào có thể; theo dõi nhiệt độ cơ thể trong năm ngày đầu tiên sau khi sẩy thai; tắm một hoặc hai lần một ngày để điều chỉnh nhiệt độ cơ thể; không thụt rửa hoặc sử dụng các chất khử trùng để vệ sinh vùng âm đạo vì có thể dẫn đến nhiễm trùng; chườm nóng và lạnh có thể giúp giảm đau và giảm đau bụng; uống ít nhất tám cốc nước mỗi ngày; tránh xa đồ uống có chứa caffein vì caffein là một chất lợi tiểu và sẽ không có tác dụng phục hồi cho cơ thể; tránh quan hệ tình dục trong hai tuần đầu sau khi sẩy thai; chờ cho máu ngừng chảy và cho cổ tử cung đủ thời gian để co và đóng lại; nói chuyện với bác sĩ của bạn trước khi bạn bắt đầu lập kế hoạch lại cho gia đình; sử dụng biện pháp tránh thai nếu bạn không muốn có thai sớm; đừng khó khăn với bản thân vì bạn sẽ vượt qua được nỗi đau này và làm lại từ đầu cùng gia đình mình; bạn phải hiểu và tin rằng những điều đã xảy ra không phải lỗi của bạn; bạn phải vượt qua nó để lập kế hoạch cho gia đình của bạn trong tương lai; hãy nhớ rằng nội tiết tố của bạn đã mất cân bằng và chúng cần một thời gian để bình thường hóa; bạn sẽ cáu kỉnh và ủ rũ; hiểu rằng cơ thể đang trên đường hồi phục và sẽ mất một thời gian; bạn có tuyệt vọng về việc có con không?; bạn đã trên 35 tuổi?; bạn đang lăn tăn về việc hút thai không thành công?; bạn phải hiểu rằng bạn không thể giải quyết vấn đề cho đến khi bạn biết lý do; nói về nó sẽ giúp bạn bớt đi một chút gánh nặng và giúp bạn đi tiếp tốt hơn; nhưng hãy chắc chắn rằng bạn nói chuyện với bác sĩ trước khi bắt đầu những bài tập; thuốc chống trầm cảm làm giảm các triệu chứng trầm cảm; liệu pháp tâm lý giúp đối phó với đau buồn; liệu pháp co giật điện (ect) để điều trị các trường hợp nặng bằng cách truyền dòng điện đến não; bạn không nên để mình tiếp tục rơi vào trạng thái trầm cảm; đừng cố gắng thụ thai cho đến khi bạn đã trải qua ít nhất hai chu kỳ kinh nguyệt; có một chế độ ăn uống lành mạnh và cân bằng; tập thể dục thường xuyên và giữ cân nặng phù hợp; tránh uống rượu và hút thuốc khi mang thai; hạn chế tiêu thụ caffeine; đừng bỏ qua bất kỳ dịch tiết âm đạo bất thường nào; tránh quan hệ tình dục một thời gian cho đến khi bạn thoát khỏi hậu quả của sẩy thai; dù là gì thì bạn và người ấy cũng nên trò chuyện và chia sẻ cảm xúc của nhau; hãy nhớ rằng tinh thần và thể chất mạnh mẽ sẽ giúp bạn sớm khỏe lại; người phụ nữ cần nhận được sự chia sẻ từ người thân; người phụ nữ cũng cần được bồi bổ thể chất sau khi sẩy thai; những thực phẩm tốt nhất nên ăn sau khi sẩy thai; tiêu thụ thực phẩm giàu sắt sau khi bị sẩy thai; tiêu thụ heme-iron từ thịt nạc; nên ăn nhiều thịt đỏ sau khi sẩy thai; nên nướng thay vì chiên; ăn thực phẩm giàu vitamin C để giúp cơ thể hấp thụ chất sắt tốt hơn; bạn nên tiêu thụ thực phẩm giàu magie để phục hồi sau trầm cảm; bạn cũng cần ăn nhiều trái cây và rau quả để có được chất dinh dưỡng cần thiết cho cơ thể sau sẩy thai; một chế độ ăn uống lành mạnh không những là bổ sung các thực phẩm dinh dưỡng có lợi mà còn phải tránh các thực phẩm không tốt cho cơ thể; hạn chế lượng tinh bột ít chất xơ trong chế độ ăn uống của bạn; tránh thực phẩm có đường có chỉ số đường huyết cao vì chúng cũng có thể khiến lượng đường trong máu tăng; tránh tình trạng viêm nhiễm gây đau đớn và khó chịu; tránh các loại thịt béo và các sản phẩm từ sữa (chưa tách béo) sau khi sẩy thai; đừng biến đồ ăn vặt thành món chính của bạn sau khi sẩy thai; đồ ăn vặt sẽ chỉ nạp vào bạn lượng calo rỗng và ngăn bạn tiêu thụ thực phẩm giàu chất dinh dưỡng mà cơ thể cần lúc này; hạn chế lượng đậu nành tiêu thụ sau khi sẩy thai; tránh phô mai mềm; tránh sản phẩm sữa chưa tiệt trùng; tránh thịt sống; tránh hải sản; hãy chú tâm đến thức ăn bạn nạp vào cơ thể; và chế độ ăn phù hợp cũng sẽ góp phần ngăn ngừa sẩy thai trong tương lai; không quan hệ tình dục; bạn có thể phải đối mặt với nhiều khó khăn; bạn sẽ trải qua nhiều cung bậc cảm xúc; cơ thể bạn đang dần hồi phục; sử dụng băng vệ sinh thay vì tampon; bạn có thể sử dụng lại tampon trong chu kỳ kinh nguyệt tiếp theo; không thụt rửa âm đạo; không đi bơi hay tắm bồn nước nóng; tắm bằng vòi sen hay vì bồn tắm; bạn có thể trở lại sinh hoạt thường ngày ngay khi cảm thấy ổn,trầm cảm; nhiễm khuẩn từ âm đạo vào tử cung; sẩy thai không hoàn toàn gây đau nhiều và có liên quan đến cơn đau quặn và kéo dài trong hai tuần hoặc hơn; sốc và phủ nhận; cảm giác tội lỗi và tức giận; ghen tị và cáu kỉnh với những phụ nữ mang thai khác; trầm cảm và đau khổ; khó chịu hoặc thất vọng; buồn ngủ hoặc mất ngủ; rất đói hoặc không đói; xu hướng tự sát; những cơn đau ngẫu nhiên xuất hiện
Túi ối,topic,[],,,,,,,,túi ối cũng phát triển trong giai đoạn này,,,
Trisomy 13,disease,['10'],,các vấn đề nghiêm trọng với não; các vấn đề nghiêm trọng với tim; ngón tay thừa; ngón chân thừa; hở vòm miệng; hở môi,,,,,,,,,hầu hết trẻ sơ sinh bị trisomy 13 chết trong năm đầu tiên của cuộc đời
Huyết áp cao,topic,"['74', '54']",,,,,,,,,,,những nguy cơ bao gồm các vấn đề về nhau thai; sự phát triển của bào thai bị ảnh hưởng
