entity_name,entity_type,article_ids,application,symptom,treatment,cause,subtopic,definition,subdisease,detail,prevention,advice,complication
Triệt sản,topic,[],,mệt mỏi; buồn nôn; đầy hơi; đau vai; đau họng; buồn nôn; nôn; chảy máu; chóng mặt; vẫn có thể mang thai; đau giống đau bụng kinh; hoa mắt; nổi mẩn,quy trình triệt sản nữ được gọi là thắt ống dẫn trứng; quy trình triệt sản nam được gọi là cắt bỏ đoạn ống dẫn tinh; mổ bụng qua vết mổ nhỏ; nội soi ổ bụng; nội soi buồng tử cung; rạch da nhỏ; đưa vòi trứng ra ngoài; thắt bằng clip; cắt bỏ đoạn nhỏ; cắt hoặc thắt ống dẫn tinh; rạch nhỏ bìu; kéo ống dẫn tinh; cắt đoạn nhỏ; cột và gắn lại bằng nhiệt; tạo mô sẹo; thực hiện với gây tê tại chỗ; có thể phẫu thuật nối ống; có thể dùng hỗ trợ sinh sản; thắt ống dẫn trứng; phẫu thuật qua ổ bụng ít xâm lấn (minilaparotomy); phẫu thuật nội soi ổ bụng (laparoscopy); phẫu thuật nội soi buồng tử cung (hysteroscopy); ống dẫn trứng sẽ được cắt và thắt lại bằng chỉ phẫu thuật hoặc bằng kẹp; thời gian hồi phục nhanh hơn; ít biến chứng hơn; thường thực hiện ngoại trú; hiệu quả ngay tức thì sau phẫu thuật; thực hiện đường rạch nhỏ trên bụng để đóng ống dẫn trứng; cột ống dẫn trứng; kẹp ống dẫn trứng; đốt điện ống dẫn trứng; gây tắc ống dẫn trứng bằng mô sẹo sau khi đặt dụng cụ cấy ghép,lậu; herpes; mụn cóc sinh dục; ống dẫn trứng sẽ được cắt và thắt lại bằng những sợi dây đặc biệt; miệng cắt sẽ được đóng kín bằng chỉ phẫu thuật; miệng cắt sẽ được đóng kín bằng kẹp; miệng cắt sẽ được đóng kín bằng cách đốt điện; gây tắt ống dẫn trứng bằng cách đưa vào lòng ống dẫn trứng một dụng cụ cấy ghép mô nhỏ (implants) làm hình thành mô sẹo; virus suy giảm miễn dịch người (hiv),Triệt sản ống dẫn trứng; Triệt sản qua soi tử cung,triệt sản là biện pháp tránh thai vĩnh viễn; triệt sản là một biện pháp tránh thai vĩnh viễn; triệt sản là một phương pháp tránh thai vĩnh viễn; triệt sản ống dẫn trứng là các thủ thuật dành cho phụ nữ nhằm đóng kín ống dẫn trứng. ngăn cản trứng di chuyển xuống tử cung và ngăn tinh trùng gặp trứng.; là một loại triệt sản ống dẫn trứng,,thời gian có hiệu quả: 2–4 tháng để tinh dịch hết tinh trùng; ống dẫn trứng: là ống mà trứng đi từ buồng trứng đến tử cung; thường dùng sau khi sinh bé; cần 3 tháng để hoàn tất; đây là dạng tránh thai phổ biến nhất trên thế giới; việc thắt ống dẫn trứng nhằm mục đích là để ngăn trứng gặp tinh trùng; triệt sản bằng phẫu thuật nội soi qua ổ bụng có hiệu quả rất cao trong phòng tránh thai; một lỗ nhỏ khác cũng sẽ được mở gần đó để đưa dụng cụ thắt ống dẫn trứng vào; phần lớn hồi phục trong 1 tuần; thắt ống dẫn trứng là phương pháp triệt sản dành cho nữ giới; hiệu quả: <1/1000 phụ nữ có thai trong vòng 5 năm sau thủ thuật.; các mô này tạo thành mô sẹo gây bít tắc ống; không có hiệu quả tức thì. cần 3 tháng để mô sẹo bít kín.; thường thực hiện tại phòng khám với gây tê tại chỗ hoặc thuốc an thần; cũng có thể tiến hành tại phòng mổ với gây mê toàn thân; không cần phẫu thuật mổ rạch; không cần vết mổ; dùng lối tự nhiên; có thể thực hiện với gây tê tại chỗ; phục hồi nhanh hơn so với triệt sản khác,sử dụng bao cao su dành cho nam hoặc bao cao su dành cho nữ để bảo vệ,khi lựa chọn một phương pháp triệt sản cần cân nhắc: sự lựa chọn cá nhân; người có nguy cơ cao vẫn cần dùng bao cao su; cần dùng biện pháp tránh thai khác cho tới khi xét nghiệm tinh dịch cho thấy không còn tinh trùng; phụ nữ có nguy cơ lây nhiễm những bệnh này khi quan hệ tình dục thì nên sử dụng bao cao su dành cho nam hoặc bao cao su dành cho nữ để bảo vệ; không cần phẫu thuật mổ rạch; không cần vết mổ; dùng lối tự nhiên; có thể thực hiện với gây tê tại chỗ; phục hồi nhanh hơn so với triệt sản khác,nhiễm trùng; chảy máu; biến chứng hay gặp nhất liên quan đến gây mê toàn thân; tổn thương ruột; tổn thương bàng quang; tổn thương mạch máu lớn; bỏng da; bỏng ruột; mang thai sau phẫu thuật rất hiếm; nguy cơ thai ngoài tử cung cao hơn; nếu muốn mang thai lại thường không thành công; nếu mang thai thì nguy cơ thai ngoài tử cung cao; bỏng da hoặc ruột; nguy cơ thai ngoài tử cung cao; vẫn có thể mang thai
Các biện pháp tránh thai nội tiết,subtopic,[],,,,,,,,,,cần dùng bao cao su để phòng tránh stds,
Rủi ro xét nghiệm chẩn đoán,topic,['10'],,,,,,,,,,,làm tăng nguy cơ sẩy thai
Thuyên tắc phổi,disease,['92'],,ho đột ngột; có thể ra máu; hụt hơi; đau ngực dưới vú; đau 1 bên ngực; đau khi thở; cảm giác nặng ngực; thở nhanh; tim nhanh,,huyết khối tĩnh mạch sâu,,,,,,,
Xét nghiệm tiền sản,topic,['10'],sàng lọc trước sinh đánh giá nguy cơ bị dị tật bẩm sinh hoặc rối loạn di truyền của trẻ; xét nghiệm chẩn đoán có thể giúp xác định những dị tật bẩm sinh hoặc rối loạn di truyền của thai nhi; đánh giá nguy cơ bị dị tật bẩm sinh hoặc rối loạn di truyền của trẻ; Giúp xác định những dị tật bẩm sinh hoặc rối loạn di truyền của thai nhi,,,,,,,,,,
Tiểu đường,disease,"['74', '56', '65', '64', '93']",kiểm tra tiểu đường thai kỳ,vàng da; chóng mặt; vã mồ hôi; run; đi tiểu thường xuyên hơn; khát nước nhiều hơn; cực kỳ mệt mỏi; hô hấp kém; hạ đường huyết; đói đột ngột; yếu; khát nước hoặc đi tiểu liên tục; đói liên tục; giảm cân mà không hề do kiêng ăn hoặc cố gắng giảm cân; mờ mắt mệt mỏi; bất kỳ triệu chứng của bệnh tiểu đường loại 1; vết loét lâu lành; mất cảm giác hoặc ngứa ran ở bàn chân,sẽ dẫn đến tiểu đường thai kỳ; đa số kiểm soát bằng chế độ ăn và tập luyện; nếu không đủ sẽ dùng thuốc hoặc insulin để giữ đường máu ổn định; đường huyết được theo dõi chặt chẽ (thường mỗi giờ); có thể dùng insulin tĩnh mạch; người dùng bơm insulin có thể tiếp tục trong quá trình này; người bệnh tiểu đường loại 1 cần phải dùng insulin mới sống được,một số trường hợp đã có tiểu đường nhẹ từ trước nhưng chưa chẩn đoán; nếu insulin sản xuất thêm không đủ; insulin không đủ; cơ thể kháng insulin; bỏ bữa; ăn ít; tập quá sức; cơ thể không thể tự tạo ra insulin được hoặc sản xuất insulin rất ít; cơ thể trở nên “lờn” với insulin và phải sản xuất thêm nhiều insulin hơn nữa mới đủ để giữ cho mức đường trong máu bình thường; bệnh tiểu đường loại 2 cũng có thể do các bệnh khác gây ra hoặc do tác dụng phụ của một số thuốc,,bệnh tiểu đường có thể do di truyền hoặc do ảnh hưởng lối sống.; tiểu đường thai kỳ là bệnh đái tháo đường được phát hiện lần đầu ở phụ nữ mang thai; đái tháo đường là tình trạng lượng glucose trong máu cao; bệnh tiểu đường xảy ra khi insulin không đủ hoặc cơ thể kháng insulin; đây là bệnh tiểu đường tiền thai kỳ nếu có trước khi mang thai; có hai loại bệnh tiểu đường được gọi là tiểu đường loại 1 và tiểu đường loại 2.,Tiểu đường loại 1; Tiểu đường loại 2,xét nghiệm đường huyết bất kỳ hay còn gọi thử đường huyết bình thường: nhân viên y tế có thể kiểm tra đường huyết lúc bạn không nhịn đói để sàng lọc bệnh và kiểm tra.; nhiều phụ nữ bị sốc khi phát hiện ra rằng mình mắc tiểu đường thai kỳ vì thường không có dấu hiệu cụ thể; những dấu hiệu này ít phổ biến và cũng thường xảy ra trong thai kỳ nên dễ bị bỏ qua; kiểm soát đường huyết khi mang thai vô cùng quan trọng đối với sức khỏe của mẹ và bé; glucose là nguồn năng lượng chính của cơ thể; từ tuần 24–28; đa số tiểu đường thai kỳ biến mất sau sinh nhưng làm tăng nguy cơ tiểu đường sau này; nếu có sẵn tiểu đường nhẹ trước mang thai thì sẽ kéo dài suốt đời; cần xét nghiệm lại đường huyết 6–12 tuần sau sinh; đa số trẻ khỏe sau sinh nhưng một số cần chăm sóc đặc biệt,có một chế độ ăn uống lành mạnh và tập thể dục thường xuyên; giảm cân – một phần quan trọng trong quá trình ngăn ngừa bệnh tiểu đường; giữ cân nặng của bạn trong phạm vi bảo đảm sức khỏe; sử dụng chỉ số khối lượng cơ thể (BMI) để đánh giá xem cân nặng có nằm trong khoảng cho phép không; cố gắng tập thể dục ít nhất 30 phút mỗi ngày vào hầu hết các ngày trong tuần,cần phải làm xét nghiệm để biết có bị tiểu đường hay không; tập thể dục; kiểm soát đường huyết tốt sẽ giảm nguy cơ này; cần theo dõi sức khỏe; theo dõi đường máu hàng ngày; ăn uống lành mạnh; tập thể dục thường xuyên; đôi khi cần thuốc; có thể cần kích thích sinh sớm để tránh biến chứng; con cũng cần được theo dõi yếu tố nguy cơ tiểu đường trong quá trình lớn lên; phụ nữ tiểu đường nên nói với bác sĩ trước khi mang thai để kiểm soát đường huyết; ăn uống đúng cách; dùng thuốc theo chỉ định; khám thai thường xuyên; gia đình cần biết cách xử trí; tập thể dục giúp kiểm soát đường huyết; tập thể dục giúp kiểm soát cân nặng; tập thể dục tăng năng lượng; tập thể dục cải thiện giấc ngủ; tập thể dục giảm đau lưng; tập thể dục giảm táo bón; tập thể dục giảm đầy hơi; phụ nữ tiểu đường có thể cho con bú; sữa mẹ tốt cho bé; cho con bú giúp mẹ giảm cân sau sinh; cho con bú giúp tử cung hồi phục nhanh hơn,bệnh thận có thể dẫn đến cao huyết áp hoặc suy thận; hàm lượng cholesterol trong máu cao có thể dẫn đến đột quỵ và bệnh tim; vấn đề trong thai kỳ; các vấn đề về tuyến giáp; sinh con dị tật bẩm sinh; huyết áp cao; hội chứng trẻ sơ sinh khổng lồ; sinh non; dị tật bẩm sinh; thai to; biến chứng thận; nguy cơ biến chứng sẽ tăng lên; cần phải giục sinh; sinh mổ; sinh con lớn hơn bình thường (thai to); gây khó khăn và căng thẳng cho em bé khi sinh; trẻ sơ sinh có nguy cơ bị hạ đường huyết sơ sinh; trẻ sơ sinh có nguy cơ tử vong chu sinh (thai chết lưu từ tuần 28 đến 7 ngày sau sinh); trẻ sinh ra từ mẹ bị tiểu đường thai kỳ có nguy cơ thừa cân hoặc béo phì cao hơn; trẻ sinh ra từ mẹ bị tiểu đường thai kỳ có nguy cơ phát triển bệnh tiểu đường type 2; khi lượng glucose trong máu quá cao sẽ gây vấn đề sức khỏe; làm tăng nguy cơ sinh con rất lớn (macrosomia); tăng nguy cơ cao huyết áp; tăng nguy cơ tiền sản giật; dễ phải mổ lấy thai; trẻ có thể gặp vấn đề hô hấp; trẻ có thể gặp hạ đường huyết; trẻ có thể gặp vàng da; mẹ có nguy cơ cao mắc tiểu đường sau này; con cũng tăng nguy cơ tiểu đường hoặc béo phì; biến chứng tim; nhiều vấn đề sức khỏe nghiêm trọng; cao huyết áp; đa ối; mổ lấy thai khó khăn; nồng độ đường cao sớm có thể gây dị tật khi cơ quan bé phát triển trong 8 tuần đầu
Thuốc diệt tinh trùng,subtopic,['17'],Làm bất hoạt tinh trùng; Có thể được sử dụng riêng lẻ hoặc phối hợp với các phương pháp rào cản khác,,,nonoxynol-9,,thuốc diệt tinh trùng là một chất hóa học làm bất hoạt tinh trùng,,bạn cần đợi 10 – 15 phút sau khi đặt thuốc diệt tinh trùng để thuốc bắt đầu có tác dụng; bạn cũng cần đọc hướng dẫn sử dụng thuốc cẩn thận để biết được thời điểm cần phải đưa thuốc diệt tinh trùng vào âm đạo trước khi quan hệ; hãy nhớ rằng thuốc diệt tinh trùng chỉ có hiệu quả trong 1 giờ sau khi sử dụng; không được thụt rửa hoặc cố gắng lấy thuốc diệt tinh trùng ra trong ít nhất 6 giờ sau khi đặt; nonoxynol-9; Có thể được sử dụng riêng lẻ hoặc phối hợp với các phương pháp rào cản khác,,thuốc diệt tinh trùng rất dễ sử dụng và có thể được mua ở nhiều hiệu thuốc khác nhau; thuốc diệt tinh trùng ít tốn kém hơn so với biện pháp tránh thai khác; thuốc diệt tinh trùng không ảnh hưởng tới nội tiết tố tự nhiên của người phụ nữ; thuốc diệt tinh trùng không ảnh hưởng đến nguồn sữa nếu bạn đang cho con bú,thuốc diệt tinh trùng có thể gây nóng rát và kích ứng âm đạo; một số người dị ứng với thuốc diệt tinh trùng
Yếu tố quyết định giới tính bé,topic,['10'],,,,nhiễm sắc thể giới tính,,,,có hai nhiễm sắc thể giới tính là x và y; tế bào trứng chỉ có nhiễm sắc thể x trong khi tế bào tinh trùng có thể chứa nhiễm sắc thể x hoặc nhiễm sắc thể y; hợp tử chứa nhiễm sắc thể xx sẽ phát triển thành bé gái còn hợp tử chứa nhiễm sắc thể xy sẽ phát triển thành bé trai,,,
Những thay đổi ngoài da,topic,[],,sưng; đau; mụn trứng cá; nốt đen ở ngực; nốt đen ở núm vú; nốt đen ở mặt trong đùi; thâm nám (melasma) trên mặt; đường đen Linea nigra từ rốn đến lông mu; vết rạn da; tĩnh mạch hình mạng nhện; giãn tĩnh mạch; mụn trứng cá khởi phát hoặc nặng thêm khi mang thai; xanh tím ở chân; giãn tĩnh mạch ở âm hộ; giãn tĩnh mạch ở trực tràng (trĩ); nốt ngứa giống côn trùng cắn; bọng nước; rụng tóc hàng loạt sau sinh 3 tháng; móng tay chân mọc nhanh hơn hoặc dễ gãy,,đa số liên quan đến thay đổi hormone trong thai kỳ; một số chưa rõ nguyên nhân; nốt đen và thâm nám là do tăng melanin; do nội tiết và tăng thể tích máu; do tử cung chèn ép tuần hoàn,,,,xuất hiện tam cá nguyệt 3; thường trở lại bình thường sau 6 tháng sau sinh; tóc mọc lại sau 3–6 tháng,uống nhiều nước; đi lại thường xuyên; tránh ngồi bắt chéo chân; kê cao chân; tập thể dục; mang tất quần; ăn nhiều chất xơ,rửa mặt 2 lần/ngày bằng sữa rửa dịu nhẹ; gội đầu thường xuyên nếu tóc dầu; tránh nặn mụn; dùng mỹ phẩm không chứa dầu,
Hội chứng fas,disease,[],,tật đầu nhỏ; dị dạng thể chất; dị dạng trí tuệ; mặt dị dạng; phát triển chậm,,uống rượu trong thai kỳ,,,,,,không có lượng rượu an toàn trong thai kỳ,
Chất chủ vận thụ thể beta - adrenergic,topic,[],,,,,Terbutaline,,,,,,
Sự rụng trứng,topic,[],,,,,,,,thường xảy ra khoảng 2 tuần trước kỳ kinh tiếp theo; trứng sau khi rụng có khả năng thụ thai trong vòng 24 giờ; tinh trùng có thể sống trong cơ thể phụ nữ 3 ngày hoặc hơn,,,
Sự phát triển của thai nhi trong những tuần cuối,topic,[],,,,,,,,não bộ phát triển rất nhanh trong giai đoạn cuối của thai kì – nó phát triển ở mức 1/3 giữa tuần 35 và 39; những lớp mỡ sẽ được tập trung lại vào dưới da của đứa trẻ; lớp mỡ sẽ giúp giữ ấm đứa trẻ sau khi sinh,,,
Virus zika,disease,[],,,,muỗi đốt; lây qua đường tình dục,,,,hiện nay không có vaccine ngăn ngừa virus zika,không đi đến các khu vực đang có virus zika đang hoạt động; thực hiện các bước ngăn ngừa muỗi đốt; tránh lây zika qua đường tình dục,,tật đầu nhỏ
Say tàu xe,topic,['59'],,mệt mỏi; buồn nôn; nôn; chóng mặt; xanh xao; đau đầu nhẹ; yếu sức; lo lắng; tăng tiết nước bọt; đổ mồ hôi; nôn nhiều,Scopolamine dạng dán 12 giờ trước đi; Meclizine cho hiệu quả lâu dài; bổ sung Vitamin B6,đi ô tô; đi máy bay; đi tàu thuyền; xe di chuyển chậm gây mất cân bằng trong tai; ăn quá no; không khí ngột ngạt hoặc nhiều khói; Não nhận tín hiệu nhầm do bất đồng giữa chuyển động dự kiến và thực tế; rối loạn chất dẫn truyền thần kinh,,,,thường hết khi ngừng di chuyển; đôi khi kéo dài đến 3 ngày,,trước khi dùng thuốc cần tham khảo ý kiến bác sĩ để đảm bảo an toàn cho mẹ và bé,mất nước
Hội chứng turner,disease,[],,cổ có màng; chiều cao ngắn,,nhiễm sắc thể x bị thiếu hoặc hư hỏng,,một tình trạng ảnh hưởng đến nữ giới trong đó có nhiễm sắc thể x bị thiếu hoặc hư hỏng,,,,,các vấn đề về tim
Đau khi quan hệ tình dục,disease,"['117', '2']",,đau vùng chậu; đau lưng dưới; đau âm hộ; đau tiền đình âm đạo; đau bên trong âm đạo; đau tầng sinh môn; đau tử cung; đau bàng quang,,âm đạo hẹp; màng trinh dày; nhiễm trùng âm hộ; bệnh niệu đạo; lạc nội mạc tử cung; viêm vùng chậu; bệnh phụ khoa; u nang buồng trứng; rối loạn đáp ứng tình dục; thiếu ham muốn; thiếu kích thích; viêm da âm hộ; đau âm hộ (vvs); thay đổi hormon (khô âm đạo do mãn kinh); viêm âm đạo (nấm/vi khuẩn); co thắt âm đạo; biến chứng sau sinh (rạch tầng sinh môn); dải sợi dính,,,,có thể thoáng qua hoặc dai dẳng,,sử dụng chất bôi trơn; điều chỉnh thời gian quan hệ; trao đổi với bạn tình; thử hành vi tình dục ít gây đau; mát-xa; giảm đau trước khi quan hệ; chườm lạnh sau quan hệ,
Chẩn đoán tiền sản,topic,['49'],,đau nhẹ,,,,,,thời điểm: chọc ối khi thai ≥15 tuần; thời điểm: sinh thiết gai nhau khi thai 10–12 tuần; có gây tê tại chỗ; nhưng đa số bình thường,,sản phụ nghỉ ngơi trong ngày; hôm sau sinh hoạt bình thường; bác sĩ cần giải thích rõ lợi ích và nguy cơ trước khi thực hiện,thủ thuật có thể gây chảy máu âm đạo nhẹ
Địa y sclerosus,disease,['101'],,ngứa; rát; đau khi quan hệ; rách da; da mỏng; da trắng; da nhăn; vết sưng trắng; vết sưng tím,kem steroid,,,,,,,,
Nhiễm khuẩn âm đạo,disease,['114'],,khí hư nhiều; mùi tanh cá; loãng; màu xám; đôi khi xanh; thường không ngứa; nếu khí hư quá nhiều có thể gây ngứa; khí hư có mùi tanh cá; khí hư loãng; khí hư màu xám; khí hư đôi khi xanh; âm đạo thường không ngứa; khí hư quá nhiều có thể gây ngứa,dùng metronidazole; dùng clindamycin,,,nhiễm khuẩn âm đạo là tình trạng vi khuẩn thường trú phát triển quá mức,,,,,
Đau lưng,topic,['42'],,đau; mỏi; cứng cơ,có thể dùng túi chườm nóng hoặc lạnh tại chỗ,thay đổi nội tiết tố; căng cơ vùng lưng; tử cung to và nặng hơn; phần trước cơ thể nặng làm mẹ bầu có xu hướng ngả ra trước; tư thế thay đổi khiến nhóm cơ lưng bị căng; cơ vùng bụng bị giãn và yếu hơn; giảm khả năng nâng đỡ; góp phần gây đau lưng khi vận động; nội tiết tố thai kỳ làm giãn dây chằng khớp vùng chậu; cơ bụng yếu,,,,,,mang giày phù hợp (không quá phẳng hoặc quá cao gót); tập thể dục nhẹ tăng sức cơ lưng và chân; giữ tư thế đúng (cần hướng dẫn chuyên môn và chỉ thực hiện nếu thai kỳ bình thường),gây đau do khớp bị giãn
Hội chứng down,topic,[],,chậm phát triển trí tuệ; có những đặc điểm bất thường ở mặt; trẻ chậm phát triển trí tuệ; có đặc điểm bất thường khuôn mặt,,thừa 1 nhiễm sắc thể 21; thừa 1 nhiễm sắc thể 21,,,,,,,bị tim bẩm sinh; có thể kèm dị tật tim bẩm sinh
Rau bong non,topic,['79'],,đau bụng; ra máu nhẹ; không ra máu,cần điều trị cấp cứu,,,,,,,,làm gián đoạn trao đổi oxy
Chăm sóc khi mang thai,topic,['74'],,,,,,,,,,hãy tiếp tục giữ gìn và chăm sóc sức khỏe của bạn thật tốt trong quá trình mang thai; đi khám thai sớm và đều đặn trong suốt thai kỳ,
Thai lạc chỗ,topic,['79'],,đau bụng; chảy máu,,,,thai lạc chỗ là trứng thụ tinh không làm tổ trong buồng tử cung mà ở vị trí khác,,thường là vòi tử cung,,,vỡ vòi tử cung; chảy máu ổ bụng; mất máu; mệt; choáng; có thể tử vong
Viêm gan C,subdisease,"['76', '44']",,không có triệu chứng,sẽ được xét nghiệm HCV,,,,,viêm gan C lây truyền qua máu; có thể nhiễm trong khi sinh nếu mẹ bị bệnh; không lây qua tiếp xúc thông thường hoặc khi cho con bú,,trẻ thường được xét nghiệm khi đủ 18 tháng tuổi; mẹ bị viêm gan C vẫn có thể cho con bú,xơ gan; ung thư gan; bệnh gan mạn tính
Ngừa thai khẩn cấp ulipristal,subtopic,[],,,,,,,,hiệu quả trong vòng 120h,,,
Trứng trống,disease,['182'],,bào thai không phát triển; có thể có túi thai; có thể có túi noãn hoàng; không có sự phát triển của thai nhi,,,,,,,,,
Kháng thể rh,topic,[],,,,,,,,,,nếu chưa có kháng thể → tiêm globulin miễn dịch rh; nếu có → cần theo dõi đặc biệt,
Chuyển dạ giả,topic,[],,cơn co tử cung; cơn co braxton hicks; tình trạng co bóp vùng bụng từng cơn; cơn co thắt có tần số xuất hiện ổn định; cơn co thắt không nặng lên khi đi lại; cơn co thắt không kéo dài; cơn co thắt không cảm thấy đau tăng lên theo thời gian; cơn co thắt không đều đặn; cơn co thắt có thể gây đau,,,,,,các cơn co thắt này thường xảy ra vào cuối ngày,,,
Xét nghiệm máu,topic,[],theo dõi thai kỳ; phát hiện được nhiễm trùng hoặc tình trạng bất thường,,,,,,,,,,nguy cơ gây hại cho mẹ và thai nhi
Test co thắt đả kích,topic,['46'],,nhịp tim thai không giảm sau khi tử cung co thắt; giảm nhịp tim thai sau hầu hết các đợt co thắt tử cung; nhịp tim thai không giảm; nhịp tim thai giảm sau hầu hết các cơn co,,,,,,kết quả có thể không rõ ràng hoặc không thỏa mãn (khi không đủ co thắt để tạo ra một kết quả có ý nghĩa); có thể không rõ nếu số lần co không đủ,,dùng khi kết quả test khác không rõ; cần theo dõi thêm,
